{
  "schemaVersion": "1.0",
  "objectType": "Decision",
  "objectId": "DEC-0002",
  "revision": 1,
  "createdAt": "2026-09-25T00:00:00Z",
  "updatedAt": "2026-09-25T00:00:00Z",
  "events": [],
  "state": "ACTIVE",
  "category": "ARCHITECTURE",
  "title": "Schemas plus policy.json are the canonical control-plane contract",
  "problem": "Rules must live in one machine-checked place; prose, prompts and memory files drift.",
  "options": [
    {
      "id": "canonical-files",
      "summary": "JSON Schemas (docs/engineering-operations/workforce/schemas) define object shape; policy.json defines state machines, command authorization, SYSTEM allowlist, human approval, reservation compatibility, lease TTLs, scheduler/backpressure/anti-thrash parameters, merge lanes and evidence trust"
    },
    {
      "id": "prose",
      "summary": "Markdown rules only"
    }
  ],
  "selectedOption": "canonical-files",
  "rationale": "The engine loads and validates policy.json (fail closed) and pins its digest on every event. Operational state (heartbeats, leases, store) lives outside git under .arena/workforce-state/ (gitignored). Manager memory files are derived views regenerated by the CLI. GitHub main remains the single code authority; no second authority is created.",
  "scope": {
    "programs": [
      "GOVERNANCE"
    ],
    "slices": [],
    "domains": [],
    "surfaces": []
  },
  "authority": {
    "decidedBy": "MANAGER-01",
    "managerOnly": true,
    "humanEscalation": false,
    "proposedBy": "MANAGER-01"
  },
  "evidence": [],
  "evidenceRefs": [
    "docs/engineering-operations/workforce/schemas/",
    "docs/engineering-operations/workforce/policy.json"
  ],
  "sources": {
    "issues": [
      262,
      265,
      266
    ],
    "prs": [],
    "commits": [],
    "requests": []
  },
  "supersedes": null,
  "supersededBy": null,
  "promotion": {
    "canonical": false,
    "mainPath": null,
    "mainCommitSha": null,
    "promotedAt": null,
    "promotedBy": null
  },
  "reason": null
}
