{
  "schemaVersion": "1.0",
  "objectType": "Decision",
  "objectId": "DEC-0008",
  "revision": 3,
  "createdAt": "2026-09-24T23:15:25Z",
  "updatedAt": "2026-09-25T00:44:40Z",
  "events": [],
  "state": "ACTIVE",
  "category": "RECOVERY",
  "title": "arena-manager migration to Manager memory",
  "problem": "arena-manager currently holds owner commits (12 ahead / 438 behind main) including exposed gateway tokens, and is not Manager memory.",
  "options": [
    {
      "id": "preserve-rebuild",
      "summary": "Archive tag, audit unique commits, recover valid work via verified PRs/cherry-picks, preserve history, then rebuild from main as Manager memory; force-push only arena-manager and only after preservation"
    },
    {
      "id": "leave",
      "summary": "Leave as is"
    }
  ],
  "selectedOption": "preserve-rebuild",
  "rationale": "Execution is BLOCKED on an authorized write credential. No history is destroyed before an archive tag exists and the audit is published.",
  "scope": {
    "programs": [
      "GOVERNANCE"
    ],
    "slices": [],
    "domains": [],
    "surfaces": []
  },
  "authority": {
    "decidedBy": "MANAGER-01",
    "managerOnly": true,
    "humanEscalation": true,
    "proposedBy": "MANAGER-01"
  },
  "evidence": [],
  "evidenceRefs": [
    "https://github.com/Catzpro01/n8n-rust-v.4/issues/268"
  ],
  "sources": {
    "issues": [
      259,
      262,
      268
    ],
    "prs": [
      273
    ],
    "commits": [
      "9b32740591b4fb2f11463c5302b5bccd5f2a796c"
    ],
    "requests": []
  },
  "supersedes": null,
  "supersededBy": null,
  "promotion": {
    "canonical": true,
    "mainPath": "docs/engineering-operations/workforce/decisions/DEC-0008.json",
    "mainCommitSha": "9b32740591b4fb2f11463c5302b5bccd5f2a796c",
    "promotedAt": "2026-09-25T00:17:56Z",
    "promotedBy": "MANAGER-01"
  },
  "reason": {
    "code": "TIMESTAMP_CORRECTION",
    "summary": "Revision corrects placeholder timestamps written in PR #274 (JRN-0012): createdAt was 2026-09-25T00:00:00Z (after the PR #273 merge) and is now the authored time of the PR #273 commit (2026-09-24T23:15:25Z); promotedAt was 2026-09-25T14:00:00Z and is now the PR #274 merge time (2026-09-25T00:17:56Z). Decision content unchanged.",
    "actor": "MANAGER-01",
    "refs": [
      "#273",
      "#274",
      "#276"
    ]
  }
}
