{
  "schemaVersion": "1.0",
  "objectType": "Decision",
  "objectId": "DEC-0005",
  "revision": 3,
  "createdAt": "2026-09-24T23:15:25Z",
  "updatedAt": "2026-09-25T00:44:40Z",
  "events": [],
  "state": "ACTIVE",
  "category": "ARCHITECTURE",
  "title": "Specification conflict resolutions (#265 exact matrix wins) and the AgentState release edges",
  "problem": "#262/#264 prose and the #265 exact matrices disagree in places, and #265 section 12 has no path back to AVAILABLE for a worker slot whose task was withdrawn, transferred or cancelled.",
  "options": [
    {
      "id": "exact-265",
      "summary": "Use the #265 exact transition matrices and names; add Manager-only release edges"
    },
    {
      "id": "prose",
      "summary": "Follow prose descriptions"
    }
  ],
  "selectedOption": "exact-265",
  "rationale": "Resolutions: READY_FOR_REVIEW, MERGING and VERIFYING cannot transition directly to CANCELLED (HOLD can); the CAS error is REVISION_CONFLICT; Decision has a REJECTED state; Task has a HOLD state; LOST_RECOVERY is not a Task state (recovery is expressed as the owning agent LOST plus history.recoveryCount); objectId is the task id. Amendment: AgentState gains Manager-only release edges ASSIGNED->AVAILABLE, PREPARING->AVAILABLE, WORKING->AVAILABLE, WAITING_EXTERNAL->AVAILABLE and BLOCKED->AVAILABLE, taken only by the engine when the slot holds no remaining active work. Workers can never take these edges.",
  "scope": {
    "programs": [
      "GOVERNANCE"
    ],
    "slices": [],
    "domains": [],
    "surfaces": []
  },
  "authority": {
    "decidedBy": "MANAGER-01",
    "managerOnly": true,
    "humanEscalation": false,
    "proposedBy": "MANAGER-01"
  },
  "evidence": [],
  "evidenceRefs": [
    "docs/engineering-operations/workforce/policy.json#stateMachines.AgentState.managerOnlyEdges"
  ],
  "sources": {
    "issues": [
      262,
      264,
      265
    ],
    "prs": [
      273
    ],
    "commits": [
      "9b32740591b4fb2f11463c5302b5bccd5f2a796c"
    ],
    "requests": []
  },
  "supersedes": null,
  "supersededBy": null,
  "promotion": {
    "canonical": true,
    "mainPath": "docs/engineering-operations/workforce/decisions/DEC-0005.json",
    "mainCommitSha": "9b32740591b4fb2f11463c5302b5bccd5f2a796c",
    "promotedAt": "2026-09-25T00:17:56Z",
    "promotedBy": "MANAGER-01"
  },
  "reason": {
    "code": "TIMESTAMP_CORRECTION",
    "summary": "Revision corrects placeholder timestamps written in PR #274 (JRN-0012): createdAt was 2026-09-25T00:00:00Z (after the PR #273 merge) and is now the authored time of the PR #273 commit (2026-09-24T23:15:25Z); promotedAt was 2026-09-25T14:00:00Z and is now the PR #274 merge time (2026-09-25T00:17:56Z). Decision content unchanged.",
    "actor": "MANAGER-01",
    "refs": [
      "#273",
      "#274",
      "#276"
    ]
  }
}
